A1: História Demográfica do Município de São Paulo

A1: Estrangeiros por Principais Países de Origem
A2: Município de São Paulo
A3: 1872
B5: Total | C5: Sé | D5: Ephigenia | E5: S. João Batista | F5: Braz | G5: Guarulhos | H5: N.S. do Ó | I5: Penha | J5: S. Bernardo | K5: Juquery
A6: MUNICÍPIO DE SÃO PAULO | B6: =SUM(B7:B66) -> 2427 | C6: =SUM(C7:C66) -> 1221 | D6: =SUM(D7:D66) -> 359 | E6: =SUM(E7:E66) -> 276 | F6: =SUM(F7:F66) -> 382 | G6: =SUM(G7:G66) -> 39 | H6: =SUM(H7:H66) -> 58 | I6: =SUM(I7:I66) -> 9 | J6: =SUM(J7:J66) -> 72 | K6: =SUM(K7:K66) -> 11
A7: ALEMANHA | B7: =SUM(C7:K7) -> 420 | C7: 207 | D7: 117 | E7: 28 | F7: 51 | G7: 5 | H7: 1 | I7: - | J7: 10 | K7: 1
A8: ARGENTINA | B8: =SUM(C8:K8) -> 5 | C8: 1 | D8: - | E8: 4 | F8: - | G8: - | H8: - | I8: - | J8: - | K8: -
A9: AUSTRÁLIA | B9: - | C9: - | D9: - | E9: - | F9: - | G9: - | H9: - | I9: - | J9: - | K9: -
A10: ÁUSTRIA | B10: =SUM(C10:K10) -> 9 | C10: 5 | D10: 1 | E10: 1 | F10: 1 | G10: - | H10: 1 | I10: - | J10: - | K10: -
A11: BÉLGICA | B11: =SUM(C11:K11) -> 4 | C11: 2 | D11: 1 | E11: - | F11: 1 | G11: - | H11: - | I11: - | J11: - | K11: -
A12: BOLÍVIA | B12: - | C12: - | D12: - | E12: - | F12: - | G12: - | H12: - | I12: - | J12: - | K12: -
A13: BULGÁRIA | B13: - | C13: - | D13: - | E13: - | F13: - | G13: - | H13: - | I13: - | J13: - | K13: -
A14: CANADÁ | B14: - | C14: - | D14: - | E14: - | F14: - | G14: - | H14: - | I14: - | J14: - | K14: -
A15: CHILE | B15: - | C15: - | D15: - | E15: - | F15: - | G15: - | H15: - | I15: - | J15: - | K15: -
A16: CHINA | B16: =SUM(C16:K16) -> 1 | C16: 1 | D16: - | E16: - | F16: - | G16: - | H16: - | I16: - | J16: - | K16: -
A17: COLOMBIA | B17: - | C17: - | D17: - | E17: - | F17: - | G17: - | H17: - | I17: - | J17: - | K17: -
A18: CORÉIA DO NORTE, CORÉIA DO SUL | B18: - | C18: - | D18: - | E18: - | F18: - | G18: - | H18: - | I18: - | J18: - | K18: -
A19: COSTA RICA | B19: - | C19: - | D19: - | E19: - | F19: - | G19: - | H19: - | I19: - | J19: - | K19: -
A20: CUBA | B20: - | C20: - | D20: - | E20: - | F20: - | G20: - | H20: - | I20: - | J20: - | K20: -
A21: DINAMARCA | B21: =SUM(C21:K21) -> 5 | C21: 2 | D21: 1 | E21: 2 | F21: - | G21: - | H21: - | I21: - | J21: - | K21: -
A22: EGITO | B22: - | C22: - | D22: - | E22: - | F22: - | G22: - | H22: - | I22: - | J22: - | K22: -
A23: EL SALVADOR | B23: - | C23: - | D23: - | E23: - | F23: - | G23: - | H23: - | I23: - | J23: - | K23: -
A24: EQUADOR | B24: - | C24: - | D24: - | E24: - | F24: - | G24: - | H24: - | I24: - | J24: - | K24: -
A25: ESPANHA | B25: =SUM(C25:K25) -> 44 | C25: 17 | D25: 10 | E25: 1 | F25: 8 | G25: 4 | H25: 2 | I25: - | J25: 1 | K25: 1
A26: ESTADOS UNIDOS | B26: =SUM(C26:K26) -> 29 | C26: 2 | D26: 9 | E26: 2 | F26: 2 | G26: 2 | H26: - | I26: - | J26: 12 | K26: -
A27: FINLÂNDIA | B27: - | C27: - | D27: - | E27: - | F27: - | G27: - | H27: - | I27: - | J27: - | K27: -
A28: FRANÇA | B28: =SUM(C28:K28) -> 133 | C28: 98 | D28: 16 | E28: 9 | F28: 9 | G28: - | H28: - | I28: - | J28: 1 | K28: -
A29: GRÃ-BRETANHA | B29: =SUM(C29:K29) -> 71 | C29: 9 | D29: 30 | E29: 1 | F29: 14 | G29: - | H29: 1 | I29: 3 | J29: 13 | K29: -
A30: GRÉCIA | B30: - | C30: - | D30: - | E30: - | F30: - | G30: - | H30: - | I30: - | J30: - | K30: -
A31: GUATEMALA | B31: - | C31: - | D31: - | E31: - | F31: - | G31: - | H31: - | I31: - | J31: - | K31: -
A32: GUIANA | B32: - | C32: - | D32: - | E32: - | F32: - | G32: - | H32: - | I32: - | J32: - | K32: -
A33: HOLANDA | B33: =SUM(C33:K33) -> 4 | C33: 2 | D33: 2 | E33: - | F33: - | G33: - | H33: - | I33: - | J33: - | K33: -
A34: HUNGRIA | B34: =SUM(C34:K34) -> 8 | C34: 8 | D34: - | E34: - | F34: - | G34: - | H34: - | I34: - | J34: - | K34: -
A35: ÍNDIA | B35: - | C35: - | D35: - | E35: - | F35: - | G35: - | H35: - | I35: - | J35: - | K35: -
A36: IRLANDA | B36: - | C36: - | D36: - | E36: - | F36: - | G36: - | H36: - | I36: - | J36: - | K36: -
A37: ISRAEL | B37: - | C37: - | D37: - | E37: - | F37: - | G37: - | H37: - | I37: - | J37: - | K37: -
A38: ITÁLIA | B38: =SUM(C38:K38) -> 158 | C38: 117 | D38: 10 | E38: 17 | F38: 4 | G38: 6 | H38: - | I38: - | J38: - | K38: 4
A39: IUGOSLÁVIA, BÓSNIA HERZEGOVINA, CROÁCIA, ESLOVÊNIA, MACEDÔNIA | B39: - | C39: - | D39: - | E39: - | F39: - | G39: - | H39: - | I39: - | J39: - | K39: -
A40: JAMAICA | B40: - | C40: - | D40: - | E40: - | F40: - | G40: - | H40: - | I40: - | J40: - | K40: -
A41: JAPÃO | B41: - | C41: - | D41: - | E41: - | F41: - | G41: - | H41: - | I41: - | J41: - | K41: -
A42: LÍBANO | B42: - | C42: - | D42: - | E42: - | F42: - | G42: - | H42: - | I42: - | J42: - | K42: -
A43: MÉXICO | B43: - | C43: - | D43: - | E43: - | F43: - | G43: - | H43: - | I43: - | J43: - | K43: -
A44: MOÇAMBIQUE | B44: - | C44: - | D44: - | E44: - | F44: - | G44: - | H44: - | I44: - | J44: - | K44: -
A45: MOLDÁVIA, QUIRGUISTÃO, ARMÊNIA, AZERBAIJÃO, BIELO-RÚSSIA, CASAQUISTÃO, ESTÔNIA | B45: - | C45: - | D45: - | E45: - | F45: - | G45: - | H45: - | I45: - | J45: - | K45: -
A46: NICARAGUÁ | B46: - | C46: - | D46: - | E46: - | F46: - | G46: - | H46: - | I46: - | J46: - | K46: -
A47: NORUEGA | B47: - | C47: - | D47: - | E47: - | F47: - | G47: - | H47: - | I47: - | J47: - | K47: -
A48: PANAMÁ | B48: - | C48: - | D48: - | E48: - | F48: - | G48: - | H48: - | I48: - | J48: - | K48: -
A49: PAQUISTÃO | B49: - | C49: - | D49: - | E49: - | F49: - | G49: - | H49: - | I49: - | J49: - | K49: -
A50: PARAGUAI | B50: =SUM(C50:K50) -> 9 | C50: 5 | D50: 1 | E50: - | F50: - | G50: 3 | H50: - | I50: - | J50: - | K50: -
A51: PERU | B51: - | C51: - | D51: - | E51: - | F51: - | G51: - | H51: - | I51: - | J51: - | K51: -
A52: POLÔNIA | B52: - | C52: - | D52: - | E52: - | F52: - | G52: - | H52: - | I52: - | J52: - | K52: -
A53: PORTUGAL | B53: =SUM(C53:K53) -> 966 | C53: 500 | D53: 103 | E53: 103 | F53: 205 | G53: 19 | H53: 15 | I53: 6 | J53: 13 | K53: 2
A54: REPÚBLICA DOMINICANA | B54: - | C54: - | D54: - | E54: - | F54: - | G54: - | H54: - | I54: - | J54: - | K54: -
A55: REPÚBLICA TCHECA, ESLOVÁQUIA | B55: - | C55: - | D55: - | E55: - | F55: - | G55: - | H55: - | I55: - | J55: - | K55: -
A56: ROMÊNIA | B56: - | C56: - | D56: - | E56: - | F56: - | G56: - | H56: - | I56: - | J56: - | K56: -
A57: RÚSSIA, GEÓRGIA, LETÔNIA, LITUÂNIA, USBEQUISTÃO, TAJIQUISTÃO, TURCOMENISTÃO, UCRÂNIA, | B57: =SUM(C57:K57) -> 18 | C57: 5 | D57: 13 | E57: - | F57: - | G57: - | H57: - | I57: - | J57: - | K57: -
A58: SÍRIA | B58: - | C58: - | D58: - | E58: - | F58: - | G58: - | H58: - | I58: - | J58: - | K58: -
A59: SUÉCIA | B59: =SUM(C59:K59) -> 6 | C59: 4 | D59: 2 | E59: - | F59: - | G59: - | H59: - | I59: - | J59: - | K59: -
A60: SUÍÇA | B60: =SUM(C60:K60) -> 58 | C60: 19 | D60: 6 | E60: 11 | F60: 9 | G60: - | H60: 4 | I60: - | J60: 9 | K60: -
A61: TAIWAN | B61: - | C61: - | D61: - | E61: - | F61: - | G61: - | H61: - | I61: - | J61: - | K61: -
A62: TURQUIA | B62: - | C62: - | D62: - | E62: - | F62: - | G62: - | H62: - | I62: - | J62: - | K62: -
A63: URUGUAI | B63: - | C63: - | D63: - | E63: - | F63: - | G63: - | H63: - | I63: - | J63: - | K63: -
A64: VENEZUELA | B64: - | C64: - | D64: - | E64: - | F64: - | G64: - | H64: - | I64: - | J64: - | K64: -
A65: OUTROS PAÍSES - africanos escravos (1872) | B65: =SUM(C65:K65) -> 474 | C65: 212 | D65: 37 | E65: 97 | F65: 78 | G65: - | H65: 34 | I65: - | J65: 13 | K65: 3
A66: PAÍS ESTRANGEIRO SEM ESPECIFICAÇÃO - orientais (1872) | B66: =SUM(C66:K66) -> 5 | C66: 5 | D66: - | E66: - | F66: - | G66: - | H66: - | I66: - | J66: - | K66: -
A67: Fonte: IBGE, Censos Demográficos