A1: História Demográfica do Município de São Paulo

A1: Densidade Demográfica
A2: Município de São Paulo
A3: 1950 a 2010
A5: Anos | B5: População | C5: Área | D5: Densidade
B6: Total | C6: em km2 | D6: hab/km2
A7: 1950 | B7: 2198096 | C7: 1624 | D7: =B7/C7 -> 1353.5073891625616
A8: 1960 | B8: 3666701 | C8: 1587 | D8: =B8/C8 -> 2310.4606175173285
A9: 1970 | B9: 5924615 | C9: 1509 | D9: =B9/C9 -> 3926.1862160371106
A10: 1980 | B10: 8493226 | C10: 1509 | D10: =B10/C10 -> 5628.3803843605037
A11: 1991 | B11: 9646185 | C11: 1509 | D11: =B11/C11 -> 6392.435387673956
A12: 2000 | B12: 9646185 | C12: 1509 | D12: =B11/C11 -> 6392.435387673956
A13: 2010 | B13: 10434252 | C13: 1509 | D13: =B12/C12 -> 6914.6799204771369
A14: Fonte: IBGE, Censos Demográficos e EMPLASA
A15: Elaboração: SMDU / Dipro
A16: OBS: Somente a partir de 1964 o IGC passou a calcular a área do MSP