A1: População nos Anos de Levantamento Censitário
A2: Município e Região Metropolitana de São Paulo, Estado de São Paulo e Brasil
A3: 1872 a 2010
A6: Anos | B6: Município de São Paulo | D6: Região Metropolitana de SP | F6: Estado de São Paulo | H6: Brasil
B8: População | C8: Taxa de | D8: População | E8: Taxa de | F8: População | G8: Taxa de | H8: População | I8: Taxa de
C9: Crescimento (1) | E9: Crescimento (1) | G9: Crescimento (1) | I9: Crescimento (1)
A10: 1872 | B10: 31385 | D10: - | F10: 837354 | H10: 10112061
C11: =+((B12/B10)^(1/18)-1)*100 -> 4.1218001530072712 | E11: - | G11: =+((F12/F10)^(1/18)-1)*100 -> 2.8340274996186965 | I11: 2
A12: 1890 | B12: 64934 | D12: - | F12: 1384753 | H12: 14333915
C13: =+((B14/B12)^(1/10)-1)*100 -> 13.957083072807542 | E13: - | G13: 5.1 | I13: 1.9
A14: 1900 | B14: 239820 | D14: - | F14: 2282279 | H14: 17318556
C15: 4.5 | E15: - | G15: 3.6 | I15: 2.9
A16: 1920 | B16: 579033 | D16: - | F16: 4592188 | H16: 30635605
C17: 4.2 | E17: - | G17: 2.3 | I17: 1.5
A18: 1940 | B18: 1326261 | D18: 1568045 | F18: 7180316 | H18: 41236315
C19: =+((B20/B18)^(1/10)-1)*100 -> 5.1820826308122125 | E19: =+((D20/D18)^(1/10)-1)*100 -> 5.2786805887838906 | G19: 2.4 | I19: 2.3
A20: 1950 | B20: 2198096 | D20: 2622786 | F20: 9134423 | H20: 51944397
C21: =+((B22/B20)^(1/10)-1)*100 -> 5.5750084116717336 | E21: =+((D22/D20)^(1/10)-1)*100 -> 6.0952903626007027 | G21: 3.6 | I21: 3.1
A22: 1960 | B22: 3781446 | D22: 4739406 | F22: 12974699 | H22: 70119071
C23: =+((B24/B22)^(1/10)-1)*100 -> 4.5924227723848521 | E23: =+((D24/D22)^(1/10)-1)*100 -> 5.5573815328864962 | G23: =+((F24/F22)^(1/10)-1)*100 -> 3.1962163259916965 | I23: 2.9
A24: 1970 | B24: 5924615 | D24: 8139730 | F24: 17771948 | H24: 93139037
C25: =+((B26/B24)^(1/10)-1)*100 -> 3.667172803359553 | E25: =+((D26/D24)^(1/10)-1)*100 -> 4.4569100347737756 | G25: =+((F26/F24)^(1/10)-1)*100 -> 3.488278813072565 | I25: =+((H26/H24)^(1/10)-1)*100 -> 2.4808005576036907
A26: 1980 | B26: 8493226 | D26: 12588725 | F26: 25040712 | H26: 119002706
C27: =+((B28/B26)^(1/11)-1)*100 -> 1.1639361372562496 | E27: =+((D28/D26)^(1/11)-1)*100 -> 1.8762937556663362 | G27: =+((F28/F26)^(1/11)-1)*100 -> 2.1343083290975118 | I27: =+((H28/H26)^(1/11)-1)*100 -> 1.9283424007966454
A28: 1991 | B28: 9646185 | D28: 15444941 | F28: 31588925 | H28: 146825475
C29: =+((B30/B28)^(1/9)-1)*100 -> 0.87638861338827923 | E29: =+((D30/D28)^(1/9)-1)*100 -> 1.6391639515658918 | G29: =+((F30/F28)^(1/9)-1)*100 -> 1.7822141362251243 | I29: =+((H30/H28)^(1/9)-1)*100 -> 1.6283572067882002
A30: 2000 | B30: 10434252 | D30: 17878703 | F30: 37032403 | H30: 169799170
C31: =+((B30/B28)^(1/9)-1)*100 -> 0.87638861338827923 | E31: =+((D30/D28)^(1/9)-1)*100 -> 1.6391639515658918 | G31: =+((F30/F28)^(1/9)-1)*100 -> 1.7822141362251243 | I31: =+((H30/H28)^(1/9)-1)*100 -> 1.6283572067882002
A32: 2010 | B32: 10434252 | D32: 17878703 | F32: 37032403 | H32: 169799170
A33: Fonte: IBGE, Censos Demográficos
A34: (1) Taxa de Crescimento Geométrico Anual