A1: História Demográfica do Município de São Paulo

A1: População por Faixa Etária
A2: Município de São Paulo
A3: 1872 a 2010
A5: Anos | B5: População | H5: Índice de
B6: Total | C6: 0-14 | D6: 15-24 | E6: 25-59 | F6: 60 e mais | G6: Ignorada | H6: Envelhecimento(1)
A7: 1872(2) | B7: 31329 | C7: 11793 | D7: 6126 | E7: 11622 | F7: 1652 | G7: 136 | H7: 14,0
A8: 1890 | B8: 64934 | C8: 18333 | D8: 11164 | E8: 28788 | F8: 4276 | G8: 2373 | H8: 23,3
A9: 1900 | B9: 239820 | C9: - | D9: - | E9: - | F9: - | G9: - | H9: -
A10: 1920 | B10: 579033 | C10: 203547 | D10: 134966 | E10: 213562 | F10: 23540 | G10: 3418 | H10: =F10/C10*100 -> 11.564896559516967
A11: 1940 | B11: 1326261 | C11: 412212 | D11: 847.386(3) | E11: - | F11: 65390 | G11: 1273 | H11: =F11/C11*100 -> 15.863196607570861
A12: 1950 | B12: 2198096 | C12: 639436 | D12: 475267 | E12: 967781 | F12: 113401 | G12: 2211 | H12: =F12/C12*100 -> 17.734534808800255
A13: 1960 | B13: 3781446 | C13: 1227021 | D13: 679014 | E13: 1639401 | F13: 216930 | G13: 19080 | H13: =F13/C13*100 -> 17.679404019980101
A14: 1970 | B14: 5924615 | C14: 1919302 | D14: 1193826 | E14: 2428048 | F14: 360315 | G14: 23124 | H14: =F14/C14*100 -> 18.773231101723439
A15: 1980 | B15: 8493226 | C15: 2543723 | D15: 1831125 | E15: 3574374 | F15: 538817 | G15: 5187 | H15: =F15/C15*100 -> 21.182219919385879
A16: 1991 | B16: 9646185 | C16: 2757782 | D16: 1783457 | E16: 4326618 | F16: 778328 | G16: - | H16: =F16/C16*100 -> 28.222970488602801
A17: 2000 | B17: 9646185 | C17: 2757782 | D17: 1783457 | E17: 4326618 | F17: 778328 | G17: - | H17: =F16/C16*100 -> 28.222970488602801
A18: 2010 | B18: 10434252 | C18: 2592829 | D18: 2015530 | E18: 4853694 | F18: 972199 | G18: - | H18: =F17/C17*100 -> 37.495685214875337
A19: Fonte: IBGE, Censos Demográficos
A20: (1) Índice de Envelhecimento: total de idosos para cada 100 crianças (pop 60 anos e mais/pop 0 a14 anos x 100)
A21: (2) Refere-se a população presente
A22: (3) Pop 15-19 anos = 142.297 pessoas e Pop 20-59 anos = 705.089 pessoas