A1: História Demográfica do Município de São Paulo

A1: População de 15 anos e mais, Total e Alfabetizada
A2: Município de São Paulo
A3: 1920 a 2000
A5: Anos | B5: População de 15 anos e mais | D5: Índice de
B6: Total | C6: Alfabetizada | D6: Alfabetização(1)
A7: 1920 | B7: 375486 | C7: 267800 | D7: =C7/B7*100 -> 71.320901445060542
A8: 1940 | B8: (2) | C8: (2) | D8: (2)
A9: 1950 | B9: 1556449 | C9: 1301054 | D9: =C9/B9*100 -> 83.591174526116816
A10: 1960 | B10: 2554425 | C10: 2191530 | D10: =C10/B10*100 -> 85.79347602689451
A11: 1970 | B11: 3982189 | C11: 3472313 | D11: =C11/B11*100 -> 87.196087378072718
A12: 1980 | B12: 5944316 | C12: 5339556 | D12: =C12/B12*100 -> 89.826247460599333
A13: 1991 | B13: 6888403 | C13: 6370135 | D13: =C13/B13*100 -> 92.476224169811204
A14: 2000 | B14: 7841423 | C14: 7458038 | D14: =C14/B14*100 -> 95.110772623795441
A15: Fonte: IBGE, Censos Demográficos
A16: (1) Índice de Alfabetização= Pop. Alfabetizada de 15 anos e mais/Pop.de 15 anos e mais x 100
A17: (2) Os dados do Censo de 1940 não permitem a desagregação para a faixa etária de 15 anos e mais
A18: Neste ano tem-se: População 10 anos e mais = 1.059.399 e Pop 10 anos e mais alfabetizada = 898.697
A19: OBS: Exclui a população de idade ignorada e os sem declaração de instrução